{
  "manifest_hash": "da0a5f3231f19a630d2ddbed67102dad398750a520972b1fdb078bfcad7270cd",
  "captured_at": "2026-09-29T14:04:57",
  "design_input_hash": "bde2f8bb61773ea451d21c77f44100c5fca02f3e25c57e4f9661c1144e0a7cda",
  "units": {
    "uart": {
      "kind": "peripheral",
      "signature_hash": "627fa39ebc643a98ed0eeb46becc348a809455d81cd5d68d35e1fe7e16dd65e9",
      "instances": [
        "report_uart"
      ],
      "interface_count": 5,
      "callback_count": 1,
      "fields": [
        "callback:uart_port_rx_cb_t|void (*)(uart_port_id_t id, const uint8_t *data, uint16_t len, void *user_data)",
        "callback_ctx:uart_port_rx_cb_t|isr",
        "callback_desc:uart_port_rx_cb_t|接收数据回调：本工程 RTOS=none，实现层在 USART1 接收中断内直接调用；只做置标志/短拷贝，data 仅回调期间有效",
        "config:report_uart.baudrate=115200",
        "config:report_uart.data_bits=8",
        "config:report_uart.parity=0",
        "config:report_uart.stop_bits=1",
        "hw:report_uart|USART1（PA9=TX / PA10=RX）",
        "iface:uart_port_deinit|int32_t uart_port_deinit(uart_port_id_t id)",
        "iface:uart_port_init|int32_t uart_port_init(uart_port_id_t id, const uart_port_cfg_t *cfg)",
        "iface:uart_port_read|int32_t uart_port_read(uart_port_id_t id, uint8_t *buf, uint16_t len)",
        "iface:uart_port_set_rx_cb|int32_t uart_port_set_rx_cb(uart_port_id_t id, uart_port_rx_cb_t cb, void *user_data)",
        "iface:uart_port_write|int32_t uart_port_write(uart_port_id_t id, const uint8_t *buf, uint16_t len)",
        "iface_cb:uart_port_deinit|",
        "iface_cb:uart_port_init|",
        "iface_cb:uart_port_read|",
        "iface_cb:uart_port_set_rx_cb|uart_port_rx_cb_t",
        "iface_cb:uart_port_write|",
        "iface_desc:uart_port_deinit|释放实例全部资源",
        "iface_desc:uart_port_init|绑定逻辑实例与配置（对接 S5a uart_init 成果）",
        "iface_desc:uart_port_read|非阻塞读环形缓冲中可用数据（0=暂无数据），返回实际读取字节数",
        "iface_desc:uart_port_set_rx_cb|注册接收回调（cb 为 NULL 取消注册）；未注册时中断仍搬运入环形缓冲，仅不通知",
        "iface_desc:uart_port_write|同步拷贝语义发送，返回发送字节数；失败重试由调用方处理",
        "iface_isr:uart_port_deinit|0",
        "iface_isr:uart_port_init|0",
        "iface_isr:uart_port_read|1",
        "iface_isr:uart_port_set_rx_cb|0",
        "iface_isr:uart_port_write|1",
        "instance:report_uart|5s 周期 JSON 环境数据上报 + 上位机指令接收（USART1_IRQn 接收中断，抢占2/子0），115200-8N1；S4 facts 引脚未吸附，按设计输入硬件表映射",
        "note:hw_instance 由设计输入硬件表映射；换板只改本 manifest，不改代码",
        "note:write 同步拷贝（返回后 buf 可复用）",
        "note:指令协议未定义，本期只打通接收通道，APP 侧不消费（不注册回调、不读）",
        "note:接收中断驱动：ISR 搬运入环形缓冲 + 通知回调；read 非阻塞取数据（两种方式可并用）"
      ]
    },
    "par": {
      "kind": "peripheral",
      "signature_hash": "d1dabdfd4180af56edb09313b6c3d4b051c712bb98fc2d56cd5bcc5459f4a91b",
      "instances": [
        "lcd_bus"
      ],
      "interface_count": 5,
      "callback_count": 0,
      "fields": [
        "config:lcd_bus.bus_width_bits=16",
        "hw:lcd_bus|FSMC Bank1-NE4（命令 0x6C000000 / 数据 0x6C000800，PG12=CS、PG0=RS，背光 PB0）",
        "iface:par_port_deinit|int32_t par_port_deinit(par_port_id_t id)",
        "iface:par_port_init|int32_t par_port_init(par_port_id_t id)",
        "iface:par_port_write_cmd|int32_t par_port_write_cmd(par_port_id_t id, uint16_t cmd)",
        "iface:par_port_write_data_block|int32_t par_port_write_data_block(par_port_id_t id, const uint16_t *buf, uint32_t len)",
        "iface:par_port_write_data|int32_t par_port_write_data(par_port_id_t id, uint16_t data)",
        "iface_cb:par_port_deinit|",
        "iface_cb:par_port_init|",
        "iface_cb:par_port_write_cmd|",
        "iface_cb:par_port_write_data_block|",
        "iface_cb:par_port_write_data|",
        "iface_desc:par_port_deinit|释放实例全部资源",
        "iface_desc:par_port_init|绑定逻辑实例（对接 S5a fsmc_lcd_init 总线成果）",
        "iface_desc:par_port_write_cmd|写一个命令字（16 位并口下低 8 位有效按器件协议）",
        "iface_desc:par_port_write_data_block|数据字块流式写（同步拷贝语义，返回后 buf 可复用；像素流用）",
        "iface_desc:par_port_write_data|写一个数据字",
        "iface_isr:par_port_deinit|0",
        "iface_isr:par_port_init|0",
        "iface_isr:par_port_write_cmd|1",
        "iface_isr:par_port_write_data_block|1",
        "iface_isr:par_port_write_data|1",
        "instance:lcd_bus|TFT_LCD（ILI9341 类 240x320）显存总线；命令/数据由地址线区分（对接 S5a fsmc_lcd_init 总线成果）；竖屏方向与 Gamma 序列由 driver_lcd 承载",
        "note:命令/数据地址映射只登记在 manifest 数据侧，换板/换平台只改本 manifest 与 S5a 成果",
        "note:存储器映射同步写直达，无缓冲/DMA 语义暴露"
      ]
    },
    "gpio": {
      "kind": "peripheral",
      "signature_hash": "8c5e4d60b73ec55e3f6198230cae1a1c13afde0cd874db678e13adf59beb916d",
      "instances": [
        "led_exec",
        "led_run",
        "buzzer",
        "key_mode",
        "key_switch",
        "key_mute",
        "dht11_data"
      ],
      "interface_count": 8,
      "callback_count": 0,
      "fields": [
        "config:buzzer.active_level=1",
        "config:buzzer.dir=output",
        "config:buzzer.init_level=0",
        "config:buzzer.pull=none",
        "config:dht11_data.active_level=1",
        "config:dht11_data.dir=input",
        "config:dht11_data.init_level=0",
        "config:dht11_data.pull=none",
        "config:key_mode.active_level=0",
        "config:key_mode.dir=input",
        "config:key_mode.init_level=0",
        "config:key_mode.pull=up",
        "config:key_mute.active_level=1",
        "config:key_mute.dir=input",
        "config:key_mute.init_level=1",
        "config:key_mute.pull=down",
        "config:key_switch.active_level=0",
        "config:key_switch.dir=input",
        "config:key_switch.init_level=0",
        "config:key_switch.pull=up",
        "config:led_exec.active_level=0",
        "config:led_exec.dir=output",
        "config:led_exec.init_level=1",
        "config:led_exec.pull=none",
        "config:led_run.active_level=0",
        "config:led_run.dir=output",
        "config:led_run.init_level=1",
        "config:led_run.pull=none",
        "hw:buzzer|PB8",
        "hw:dht11_data|PG11",
        "hw:key_mode|PE4",
        "hw:key_mute|PA0",
        "hw:key_switch|PE3",
        "hw:led_exec|PB5",
        "hw:led_run|PE5",
        "iface:gpio_port_deinit|int32_t gpio_port_deinit(gpio_port_id_t id)",
        "iface:gpio_port_init|int32_t gpio_port_init(gpio_port_id_t id, const gpio_port_cfg_t *cfg)",
        "iface:gpio_port_read_active|int32_t gpio_port_read_active(gpio_port_id_t id, uint8_t *active)",
        "iface:gpio_port_read|int32_t gpio_port_read(gpio_port_id_t id, gpio_port_level_t *level)",
        "iface:gpio_port_set_active|int32_t gpio_port_set_active(gpio_port_id_t id, uint8_t active)",
        "iface:gpio_port_set_dir|int32_t gpio_port_set_dir(gpio_port_id_t id, gpio_port_dir_t dir)",
        "iface:gpio_port_toggle|int32_t gpio_port_toggle(gpio_port_id_t id)",
        "iface:gpio_port_write|int32_t gpio_port_write(gpio_port_id_t id, gpio_port_level_t level)",
        "iface_cb:gpio_port_deinit|",
        "iface_cb:gpio_port_init|",
        "iface_cb:gpio_port_read_active|",
        "iface_cb:gpio_port_read|",
        "iface_cb:gpio_port_set_active|",
        "iface_cb:gpio_port_set_dir|",
        "iface_cb:gpio_port_toggle|",
        "iface_cb:gpio_port_write|",
        "iface_desc:gpio_port_deinit|释放逻辑引脚资源",
        "iface_desc:gpio_port_init|绑定逻辑引脚与配置（含有效电平 active_level）",
        "iface_desc:gpio_port_read_active|[扩展] 按有效电平读（激活=1）",
        "iface_desc:gpio_port_read|读输入电平（输出引脚读回实际输出）",
        "iface_desc:gpio_port_set_active|[扩展] 按有效电平写（active!=0 激活）",
        "iface_desc:gpio_port_set_dir|[扩展] 运行时切换方向（DHT11 单总线时序）",
        "iface_desc:gpio_port_toggle|翻转输出",
        "iface_desc:gpio_port_write|写输出电平",
        "iface_isr:gpio_port_deinit|0",
        "iface_isr:gpio_port_init|0",
        "iface_isr:gpio_port_read_active|1",
        "iface_isr:gpio_port_read|1",
        "iface_isr:gpio_port_set_active|1",
        "iface_isr:gpio_port_set_dir|0",
        "iface_isr:gpio_port_toggle|1",
        "iface_isr:gpio_port_write|1",
        "instance:buzzer|告警蜂鸣器（1s 响/1s 停，静音门控）；高电平导通",
        "instance:dht11_data|DHT11 单总线数据（外部上拉；运行时 set_dir 换向）",
        "instance:key_mode|模式切换按键（KEY0，外部上拉，按下=低）",
        "instance:key_mute|静音切换按键（WK_UP，外部下拉，按下=高）",
        "instance:key_switch|手动开关按键（KEY1，外部上拉，按下=低）",
        "instance:led_exec|执行器指示灯（亮=执行器开）；LED0，低电平点亮",
        "instance:led_run|运行指示灯（心跳/快闪/慢闪）；LED1，低电平点亮",
        "note:DHT11_DATA 需运行时换向：起始信号输出拉低 18ms 后切回输入读响应",
        "note:按键为 10ms 轮询去抖，无 EXTI（边沿中断接口已裁剪）",
        "note:有效电平语义：active_level 由实例 config 固化到实现，APP/Driver 只用 active 语义"
      ]
    },
    "adc": {
      "kind": "peripheral",
      "signature_hash": "7ae5ac26d4585c7719149f596651938e52e9e50305d141bcc48a3bfa92fc1fab",
      "instances": [
        "light_sensor"
      ],
      "interface_count": 3,
      "callback_count": 0,
      "fields": [
        "config:light_sensor.avg_count=8",
        "config:light_sensor.ref=vdd",
        "config:light_sensor.ref_mv=3300",
        "hw:light_sensor|ADC1_IN1（PA1）",
        "iface:adc_port_deinit|int32_t adc_port_deinit(adc_port_id_t id)",
        "iface:adc_port_init|int32_t adc_port_init(adc_port_id_t id, const adc_port_cfg_t *cfg)",
        "iface:adc_port_sample_mv|int32_t adc_port_sample_mv(adc_port_id_t id, uint16_t *raw_mv)",
        "iface_cb:adc_port_deinit|",
        "iface_cb:adc_port_init|",
        "iface_cb:adc_port_sample_mv|",
        "iface_desc:adc_port_deinit|释放逻辑通道资源",
        "iface_desc:adc_port_init|绑定逻辑通道与配置（对接 S5a adc_init 成果）",
        "iface_desc:adc_port_sample_mv|同步单次采样（含 avg_count 次过采样均值），输出毫伏值",
        "iface_isr:adc_port_deinit|0",
        "iface_isr:adc_port_init|0",
        "iface_isr:adc_port_sample_mv|0",
        "instance:light_sensor|光照分压网络采样（光敏电阻模块 AO）；APP 侧 light% = raw_mv*100/ref_mv",
        "note:基准换算在 Port 内完成，APP 不感知分辨率/通道号",
        "note:过采样均值：8 次（去抖动）"
      ]
    },
    "timer": {
      "kind": "peripheral",
      "signature_hash": "8611a5e9b4dca8027888f02f2465c2a0cd89294aa5c7de29c77f4f942c4869b6",
      "instances": [
        "system_tick"